{
  "$schema": "../theme.rtds.schema.json",
  "name": "folio",
  "colorSpace": "oklch",
  "light": {
    "background": { "l": 0.9659, "c": 0.0079, "h": 73.74 },
    "foreground": { "l": 0.2161, "c": 0.0061, "h": 56.04 },
    "card": { "l": 0.9659, "c": 0.0079, "h": 73.74 },
    "cardForeground": { "l": 0.2161, "c": 0.0061, "h": 56.04 },
    "primary": { "l": 0.4698, "c": 0.143, "h": 37.3 },
    "primaryForeground": { "l": 0.9796, "c": 0.0158, "h": 73.68 },
    "secondary": { "l": 0.9277, "c": 0.0154, "h": 77.07 },
    "secondaryForeground": { "l": 0.2161, "c": 0.0061, "h": 56.04 },
    "muted": { "l": 0.9277, "c": 0.0154, "h": 77.07 },
    "mutedForeground": { "l": 0.4444, "c": 0.0096, "h": 73.64 },
    "accent": { "l": 0.9619, "c": 0.058, "h": 95.62 },
    "accentForeground": { "l": 0.4732, "c": 0.1247, "h": 46.2 },
    "destructive": { "l": 0.5054, "c": 0.1905, "h": 27.52 },
    "destructiveForeground": { "l": 1, "c": 0, "h": 0 },
    "border": { "l": 0.9092, "c": 0.0166, "h": 79.35 },
    "input": { "l": 0.9092, "c": 0.0166, "h": 79.35 },
    "ring": { "l": 0.4698, "c": 0.143, "h": 37.3 },
    "success": { "l": 0.4479, "c": 0.1083, "h": 151.33 },
    "successForeground": { "l": 1, "c": 0, "h": 0 },
    "warning": { "l": 0.5538, "c": 0.1207, "h": 66.44 },
    "warningForeground": { "l": 1, "c": 0, "h": 0 }
  },
  "dark": {
    "background": { "l": 0.2161, "c": 0.0061, "h": 56.04 },
    "foreground": { "l": 0.9771, "c": 0.0074, "h": 80.72 },
    "card": { "l": 0.2161, "c": 0.0061, "h": 56.04 },
    "cardForeground": { "l": 0.9771, "c": 0.0074, "h": 80.72 },
    "primary": { "l": 0.7987, "c": 0.0822, "h": 55.87 },
    "primaryForeground": { "l": 0.2161, "c": 0.0061, "h": 56.04 },
    "secondary": { "l": 0.2685, "c": 0.0063, "h": 34.3 },
    "secondaryForeground": { "l": 0.9771, "c": 0.0074, "h": 80.72 },
    "muted": { "l": 0.2685, "c": 0.0063, "h": 34.3 },
    "mutedForeground": { "l": 0.7161, "c": 0.0091, "h": 56.26 },
    "accent": { "l": 0.3741, "c": 0.0087, "h": 67.56 },
    "accentForeground": { "l": 0.9243, "c": 0.1151, "h": 95.75 },
    "destructive": { "l": 0.7106, "c": 0.1661, "h": 22.22 },
    "destructiveForeground": { "l": 0.2575, "c": 0.0886, "h": 26.04 },
    "border": { "l": 0.3522, "c": 0.0098, "h": 61.18 },
    "input": { "l": 0.3522, "c": 0.0098, "h": 61.18 },
    "ring": { "l": 0.7987, "c": 0.0822, "h": 55.87 },
    "success": { "l": 0.8712, "c": 0.1363, "h": 154.45 },
    "successForeground": { "l": 0.2161, "c": 0.0061, "h": 56.04 },
    "warning": { "l": 0.879, "c": 0.1534, "h": 91.61 },
    "warningForeground": { "l": 0.2161, "c": 0.0061, "h": 56.04 }
  },
  "radius": "0.375rem"
}
